{
  "$schema": "https://schemas.greenflash.digital/chamfer-tokens.json",
  "runtime": {
    "prefix": "documints",
    "strict": true,
    "suppressStrictWarnings": false
  },
  "font": {
    "source": "manual",
    "families": {
      "Source Sans 3": {
        "family": "Source Sans 3",
        "styles": ["regular-400", "medium-500", "semiBold-600", "bold-700"]
      }
    },
    "variants": {}
  },
  "color": {
    "vibe": { "type": "jewel", "lightness": 0.55, "chroma": 0.18 },
    "colors": {
      "primary": { "hue": 38, "variants": 10 },
      "secondary": { "hue": 168, "variants": 10 },
      "warning": { "hue": 56, "variants": 10 },
      "danger": { "hue": 360, "variants": 10 },
      "background": { "hex": "#ffffff" },
      "surface": { "hex": "#ffffff" },
      "neutral": { "hex": "#999999", "variants": 10 }
    }
  },
  "custom": {
    "layout-header-height": {
      "type": "rem",
      "value": 64,
      "description": "The height of the header in the layout"
    },
    "layout-max-width": {
      "type": "rem",
      "value": 1440,
      "description": "The max width that the layout of the docs can go"
    }
  }
}
